{
  "$schema": "https://json-schema.org/draft/2020-12/schema",
  "$id": "https://openan.net/a2a-t-sdk/corpus/schemas/input-case.schema.json",
  "title": "A2A-T corpus input case format",
  "description": "First-hand definition of the data-driven workflow case consumed by the corpus engine. One file is a JSON array of case records. Each case declares an ordered array of SDK API steps (input) and one expectation per step (expected, aligned by index). Keys are strict: unknown keys are load-time errors.",
  "type": "array",
  "items": {
    "type": "object",
    "additionalProperties": false,
    "required": ["id", "caseDimension", "caseDesc", "caseCategory", "input", "expected"],
    "properties": {
      "id": {
        "type": "string",
        "minLength": 1,
        "description": "Case primary key, unique within one scenario."
      },
      "caseDimension": {
        "type": "string",
        "minLength": 1,
        "description": "Accuracy dimension this case exercises, the aggregation key for accuracy statistics."
      },
      "caseDesc": {
        "type": "string",
        "minLength": 1,
        "description": "One business-facing sentence describing the case."
      },
      "caseCategory": {
        "type": "string",
        "minLength": 1,
        "description": "Open enumeration of case categories, e.g. 正常 / 异常 / 边界 / 模糊语义 / ... ; statistics aggregate by the raw value."
      },
      "input": {
        "type": "array",
        "minItems": 1,
        "description": "Ordered SDK API steps; array order is the execution order; the same API may appear multiple times.",
        "items": {
          "type": "object",
          "additionalProperties": false,
          "required": ["api", "args"],
          "properties": {
            "api": {
              "type": "string",
              "minLength": 1,
              "description": "Registered SDK facade method name, e.g. generateTaskPromptFromText."
            },
            "args": {
              "type": "object",
              "description": "Request arguments for the step. Literal values take precedence; a {\"$fromStep\": N, \"$field\": \"a.b\"} object copies the field from the response of step N (1-based, earlier steps only)."
            }
          }
        }
      },
      "expected": {
        "type": "array",
        "minItems": 1,
        "description": "Per-step expectations, aligned by index with input.",
        "items": {
          "type": "object",
          "additionalProperties": false,
          "required": ["result", "error"],
          "properties": {
            "result": {
              "type": "string",
              "enum": ["success", "error"],
              "description": "Expected step outcome."
            },
            "data": {
              "type": "object",
              "description": "Subset assertion against the step response payload: every listed key must equal. Applies to the payload root, or to its nested data map when the payload carries one (FilledParamData)."
            },
            "dataExact": {
              "type": "boolean",
              "description": "When true, the asserted map must contain exactly the listed keys (no extras).",
              "default": false
            },
            "error": {
              "type": "object",
              "additionalProperties": false,
              "properties": {
                "errCode": {
                  "type": "string",
                  "description": "Exact SDK error catalog code expected when result is error; may be empty when the code is not asserted."
                },
                "errMessage": {
                  "type": "string",
                  "description": "Exact error message; when absent only non-empty is required."
                },
                "errMessageContains": {
                  "type": "string",
                  "description": "Substring the error message must contain."
                }
              }
            }
          }
        }
      }
    }
  }
}