[
  {
    "id": "TC00000001",
    "caseDimension": "01-结构化数据完整",
    "caseDesc": "无线节能-信息协商-propose-结构数据生成并校验",
    "caseCategory": "正常",
    "input": [
      {
        "api": "generateNegotiationProposePromptFromData",
        "args": {
          "data": {
            "context": {
              "id": "3dbc13b5-bd57-4c2b-b503-24e381b6c8d3",
              "round": 1,
              "maxRounds": 5,
              "performative": "PROPOSE"
            },
            "content": {
              "items": [
                {
                  "name": "节能区域信息",
                  "value": "区域：松山湖管委会"
                },
                {
                  "name": "节能速率保障目标",
                  "value": "分时段速率保障目标：{00:00~06:00,2Mbps}、{06:00~18:00,10Mbps}"
                },
                {
                  "name": "可关闭下行频点",
                  "value": "下行频点号：1650，1600"
                }
              ],
              "relationship": "以上信息项共同用于配置无线网络节能任务，缺失任一项均无法生成完整的节能方案"
            }
          },
          "templateUri": "Negotiation-T/information-negotiation/propose/v1"
        }
      },
      {
        "api": "validateProposePromptAndDataFilling",
        "args": {
          "promptText": {
            "$fromStep": 1,
            "$field": "promptText"
          },
          "context": {
            "id": "3dbc13b5-bd57-4c2b-b503-24e381b6c8d3",
            "round": 1,
            "maxRounds": 5,
            "performative": "PROPOSE"
          },
          "schema": {
            "type": "object",
            "properties": {}
          },
          "templateUri": "Negotiation-T/information-negotiation/propose/v1"
        }
      }
    ],
    "expected": [
      {
        "result": "success",
        "data": {},
        "error": {
          "errCode": "",
          "errMessage": ""
        }
      },
      {
        "result": "success",
        "data": {},
        "error": {
          "errCode": "",
          "errMessage": ""
        }
      }
    ]
  }
]
